page_10_line_1.png,क्षेत्रातील आणि राजकीय क्षेत्रातीलही काही प्रतिगामी भूमिकांमुळे ते गांधींना नेते
page_10_line_2.png,"मानायला तयार नव्हते. थोडक्यात, असे म्हणता येईल की टिळकांचे अनुयायी"
page_10_line_3.png,सनातनी ब्राह्मण्यवाद्यांबरोबर असलेली त्यांची नाळ तोडायला तयार नव्हते.
page_10_line_4.png,"ब्राह्मणेतर राबणाऱ्या जनतेने, अस्पृशय जनतेने आपले प्रतिनिधी राज्य करण्यासाठी"
page_10_line_5.png,पाठवावेत हे या मंडळींच्या पचनी पडत नव्हते. महात्मा गांधींनी मात्र या जनतेपर्यंत
page_10_line_6.png,पोहोचण्याची भूमिका घेतली होती. ब्राह्मणेतर धुरिणांना भेटायला सुरुवात केली
page_10_line_7.png,होती. १९१८ साली विठ्ठल रामजी शिंदे यांच्या मराठ्यांचा इतिहास' या विषयावरील
page_10_line_8.png,"भाषणांना ते उपस्थित राहिले. १९२४ सालापासून ते अण्णासाहेब ल्डे, कर्मवीर"
page_10_line_9.png,भाऊराव पाटील आणि केशवराव जेधे यांना त्या त्या ठिकाणी जाऊन भेटले. या सर्व
page_10_line_10.png,प्रक्रियेतून १९३० सालापर्यंत केशवराव जेधे यांच्या नेतृत्वाखाली सत्यशोधक-
page_10_line_11.png,ब्राह्मणेतर चळवळीचा एक विभाग काँग्रेसमधे सामील झाला. म. गांधींच्या
page_10_line_12.png,नेतृत्वाखाली सत्याग्रही चळवळीत भाग घेऊ लागला. क्रांतिसिंह नाना पाटील हे या
page_10_line_13.png,विभागापैकीच एक सत्यशोधक-ब्राह्मणेतर होते. हजारो लोकांना खिळवून ठेवणारी
page_10_line_14.png,भाषणे सुरु करतानाछत्रपती शिवाजीमहाराज की जय! महात्मा गांधी की जय! अशा
page_10_line_15.png,"घोषणा देऊन शडू ठोकायचे. गांधींच्या, खेड्यापाड्यांतील 'सर्वसामान्य' स्री-पुरुष"
page_10_line_16.png,जनतेपर्यंत स्वातंत्र्याचा संदेश पोहोचवण्याच्या धोरणाची अंमलबजावणी
page_10_line_17.png,क्रांतिसिंहांइतकी कुणीच केली नसेल. ब्राह्मणेतर-सत्यशोधक पुढारीपण जरी
page_10_line_18.png,राष्ट्रीय काँग्रेसमधे सहभागी झाले तरी त्यांची राबणाऱ्या ब्राह्मणेतर जाती-
page_10_line_19.png,"जमातींबरोबर असलेली नाळ तुटली नाही. त्यामुळेच, आला छत्रपती मेळा। भटांनो"
page_10_line_20.png,पळा पळा रे पळा॥' किंवा “कुठेही आडवा भट आला । राज्याचाही निकाल होईल ।
page_10_line_21.png,जाईल नाशाला' अशी गाणी म्हणणारा छत्रपती मेळा काढणारे जेधे काँग्रेसमध्ये गेले
page_10_line_22.png,आणि स्वातंत्र्यानंतर पुन्हा 'शेतकरी कामगार पक्ष' काढून काँग्रेसमधून बाहेर पडले.
page_10_line_23.png,क्रांतिसिंह नाना पाटील याच मार्गाने गेले. फरक इतकाच (आणि फारच मोठा) की
page_10_line_24.png,केशवराव जेधे पुन्हा दुसऱ्यांदा काँग्रेसमधे गेले आणि नाना पाटील पुढे कम्युनिस्ट
page_10_line_25.png,पक्षात प्रवेश करून अखेरपर्यंत कष्टकरी चळवळीच्या क्रांतिकारी प्रवाहात राहिले.
page_10_line_26.png,क्रांतिसिंहाच्या तरुण मनावर संस्कार करणाऱ्या आणखी दोन महत्त्वाच्या
page_10_line_27.png,प्रक्रिया त्या काळात सातारा जिल्ह्यात चालू होत्या. त्यापैकी एक होती सत्यशोधक
page_10_line_28.png,जलशांची सत्यशोधक तमाशांची. सातारा जिल्ह्याच्या कराड तालुक्यातील 'काळे'
page_10_line_29.png,या गावचे मराठा शेतकरी रामचंद्र घाडगे हे सत्यशोधक तमाशा पहिल्यांदा सुरू
page_10_line_30.png,करणारे पाईक होते. गरीब शेतकरी कुटुंबात जन्माला येऊन केवळ चौथीपर्यंत
page_11_line_1.png,शिकलेल्या घाडगेंच्या तमाशावर सातारा जिल्ह्यातील जनतेने त्या काळात खूपच
page_11_line_2.png,प्रेम केले. १९१५ साली या तमाशाची सुरुवात झाली. १९२५ सालापर्यंत चांगल्या
page_11_line_3.png,प्रकारे ओळखले जाणारे सुमारे एकोणतीस तमाशे महाराष्ट्रात होते. यांपैकी बारा
page_11_line_4.png,"सातारा जिल्ह्यात, पाच अहमदनगर, सहा नाशिक, दोन सोलापूर जिल्ह्यांमध्ये होते."
page_11_line_5.png,"पुणे आणि बेळगाव जिल्ह्यांमधे प्रत्येकी एक तमाशा होता. सातारा रोड, पाडळी"
page_11_line_6.png,गावचे जोतीराव फाळके आणि कवी तुकाराम भोसले यांचा तमाशा हा सर्वात जास्त
page_11_line_7.png,प्रमाणात सत्यशोधकी विचारांच्या पायावर चालणारा होता. या तमाशांचा परिणाम
page_11_line_8.png,"चांगल्या प्रकारे होत असे. जमीनदार, सावकार आणि ब्राह्मण्यवादाच्या"
page_11_line_9.png,वर्चस्वाविरुद्ध संघर्ष करण्याची शिकवण या तमाशांमधून मिळत होती. १९१९ पासून
page_11_line_10.png,पुढे दोन वर्षे झालेला कूळ शेतकरी आणि बलुतेदारांचा उठाव या प्रबोधनातून स्फूर्ती
page_11_line_11.png,"घेऊनच झाला होता. सांस्कृतिक क्षेत्रात अंधश्रद्धा, बुरसटलेल्या रूढी, ब्राह्मण्यवादी"
page_11_line_12.png,धर्म थोतांड यांना विरोध करून नवी समतावादी मूल्ये मांडणारी तमाशांची चळवळ
page_11_line_13.png,"आर्थिक क्षेत्रात जातीय जमीनदारी, जातीय उतरंड यांना विरोध करणाऱ्या"
page_11_line_14.png,चळवळीची प्रेरणा ठरली. नाना पाटील याच संस्कारात वाढले. त्यामुळे त्यांनी
page_11_line_15.png,आयुष्यभर राजकीय चळवळीबरोबरच सांस्कृतिक-धार्मिक क्षेत्रात पुरोगामी परिवर्तन
page_11_line_16.png,आणण्याला महत्त्व दिले.
page_11_line_17.png,सातारा जिल्ह्यातील शेतकरी बल्ुतेदारांच्या उठावाचेही परिवर्तनवादी
page_11_line_18.png,"संस्कार क्रांतिसिंहाच्या जडणघडणीवर झाले. सातारा जिल्ह्यातील तासगाव,"
page_11_line_19.png,"खानापूर, वाळवा, कोरेगाव आणि कराड या तालुक्यांमध्ये हा उठाव प्रामुख्याने"
page_11_line_20.png,झाला. सातारा तालुक्यातसुद्धा काही अंशी उठाव झाला. त्या काळातल्या ब्राह्मण
page_11_line_21.png,जमीनदार आणि सनातन्यांच्या साक्षीप्रमाणे ३० खेड्यांमध्ये त्यांच्या विरोधी घटना
page_11_line_22.png,घडल्या. पंढरपूर येथील ब्राह्मण्यसंरक्षक परिषदेने सातारा जिल्ह्यात ब्राह्मणांवर
page_11_line_23.png,झालेल्या तथाकथित 'अत्याचारांची' चौकशी करण्यासाठी एक कमिशन नेमले.
page_11_line_24.png,"त्यांच्या अहवालात म्हटले आहे, ""ब्राह्मणांना शिव्या देणे, बीभत्स तमाशे करणे, हिंदू"
page_11_line_25.png,"दैवते आणि धर्मगुरू यांची निंदा करणे, धाक घालणे, मजूर कामावरून पळवणे,"
page_11_line_26.png,"लागणीस आलेल्या जमिनी स्वतः न करणे व दुसऱ्यास करून न देणे, ग्रामजोशांच्या"
page_11_line_27.png,"हक्कास हरकत करणे...""असे 'अत्याचार' केले."
page_11_line_28.png,"याच घटनांच्या बाबतीत १९२३ साली एका ब्रिटिश अधिकाऱ्याने,"
page_11_line_29.png,"कौन्सिलमध्ये विचारल्या गेलेल्या प्रश्‍नाला उत्तर देताना, म्हटले आहे, “सातारा"
page_12_line_1.png,जिल्ह्यात कूळ शेतकऱ्यांचा अंशतः संप १३६६ खेड्यांपैकी २४ गावांमधे झाला होता.
page_12_line_2.png,काही ब्राह्मण जमीनदारांनी केलेल्या अव्वाच्या-सव्वा मागण्यांमुळे त्यांच्या जमिनी
page_12_line_3.png,कुळांनी न कसता पाडून ठेवल्या. ही परिस्थिती आता बदलली आहे आणि आता
page_12_line_4.png,"काही तालुक्यांमध्ये अशा जमिनी कसायला सुरुवात झाली आहे. ""ब्राह्मण"
page_12_line_5.png,जमीनदारांनी जमिनींचा खंड दोनतृतीयांश किंवा तीनचतुर्थांश पर्यंत वाढवला होता.
page_12_line_6.png,उरलेले उत्पन्न मोठ्या प्रमाणात सावकाराला जात होते. म्हणून हा उद्रेक झाला
page_12_line_7.png,होता. या कूळ शेतकऱ्यांच्या संपात बलुतेदारांनीही भागिदारी केली होती. ब्राह्मणांची
page_12_line_8.png,"कामे करायला परीट, न्हावी, कुंभार, मांग, महार अशा स्पृश्य-अस्पृश्य बलुतेदारांनी"
page_12_line_9.png,नकार दिला. त्यामुळे ब्राह्मण जमीनदारांची सर्व बाजूंनी नाकेबंदी झाली. जमीनदारी
page_12_line_10.png,आणि तिला पोटात घेणारी जातीय पिळणुकीची एकंदर बलुतेदारी चौकट यांच्यावर
page_12_line_11.png,समग्र हल्ला करणारी भारतातील ही एकमेव चळवळ आज इतिहासाला माहीत
page_12_line_12.png,"आहे. भारतातल्या खऱ्याखुऱ्या कृषी क्रांतीची, जातिव्यवस्था संपवणाऱ्या क्रांतीची"
page_12_line_13.png,झलक या उठावात दिसते. क्रांतिसिंह नाना पाटील नंतर कम्युनिस्ट पक्षात गेले. ते
page_12_line_14.png,तरुणपणी या क्रांतीचा भाग होते. पण कम्युनिस्ट पक्ष मात्र त्यांच्या जिवंत
page_12_line_15.png,अनुभवातून कधीच शिकला नाही. नाना पाटील पुढेच जात राहिले पक्ष
page_12_line_16.png,त्यांच्याबरोबर जाऊ शकला नाही.
page_12_line_17.png,सातारा जिल्ह्याचा त्या वेळचा ब्रिटिश कलेक्टर इ. इ. मोयसे हा या
page_12_line_18.png,"उठावाविषयी म्हणतो, ""ब्राह्मणांविरुद्ध गुन्हे केले गेले नाहीत असे मी म्हणणार"
page_12_line_19.png,नाही. पण अनेक चौकशांमधून आलेला अनुभव असे दाखवतो की हिंसाचाराच्या ज्या
page_12_line_20.png,घटना त्यांच्याविरुद्ध घडल्या त्या 'ब्राह्मण' जात म्हणून घडल्या नाहीत. तर त्या
page_12_line_21.png,"अप्रिय जमीनदार, सावकार म्हणून घडल्या. ज्या ब्राह्मणांविरुद्ध तक्रारी नव्हत्या"
page_12_line_22.png,त्यांना शांततेत राहू दिले गेले. आता ही चळवळ आजपर्यंत घेतल्या जाणाऱ्या
page_12_line_23.png,दोनतृतीयांश किंवा तीनचतुर्थांश खंडाऐवजी अर्ध्या उत्पन्नाएवढा खंडच फक्त
page_12_line_24.png,"देण्याकडे वाटचाल करीत आहे..."""
page_12_line_25.png,एकंदर सातारा जिल्ह्यात दोन वर्षांत जमीनदाराच्या शेतावरचे पीक कापून
page_12_line_26.png,नेण्याच्या ५ घटना; घरे लुटणे व जाळण्याच्या ६ घटना; मारहाणीच्या सहा आणि
page_12_line_27.png,खेड्यातून संबंधित ब्राह्मणांना पळवून लावण्याच्या पाच घटना नोंद झाल्या होत्या.
page_12_line_28.png,शेकडो वर्षांच्या शोषणाच्या पार्श्वभूमीवर आणि उठावाचा काळ व व्यापकता यांचा
page_12_line_29.png,विचार केला तर या घटना फार नाहीत. चीन आणि रशिया या देशांमधे झालेल्या
page_13_line_1.png,शेतकऱ्यांच्या उठावांशी तुलना करत हा 'हिंसाचार' नगण्य स्वरूपातला म्हणावा
page_13_line_2.png,लागेल. पण सनातनी ब्राह्मणांनी आणि तत्कालीन काँग्रेसच्या ब्राह्मणी पुढाऱ्यांनी
page_13_line_3.png,सामाजिक न्यायाचा विचार न करता अत्याचारांचा कांगावाच फार केला. क्रांतिसिंह
page_13_line_4.png,नाना पाटील तरण वयात या सर्व घटनांचे साक्षी आणि सहभागी होते. पुढील
page_13_line_5.png,काळात झालेला त्यांचा चळवळीतला सहभाग या महत्त्वपूर्ण चळवळीच्या खांद्यावर
page_13_line_6.png,उभे राहून झाला. सांस्कृतिक क्षेत्रात एकंदर सत्यशोधकी ब्राह्मणेतर चळवळीचा भाग
page_13_line_7.png,असणारे पण स्वतः जमीनदारी हितसंबंध असणाऱ्या ब्राह्मणेतरांनी या चळवळीला
page_13_line_8.png,पाठिंबा दिला नव्हता. त्याच बरोबर काँग्रेसच्या ब्राह्मणी पुढाऱ्यांनीही दिला नव्हता.
page_13_line_9.png,ब्रिटिश सरकारविरुद्ध साराबंदीसारखी चळवळ करायला काँग्रेस पुढारी पाठिंबा देत
page_13_line_10.png,होते. पण जमीनदारी आणि जातिव्यवस्थेच्या विरुद्ध आवाज उठवणारी चळवळ
page_13_line_11.png,त्यांना परवडत नव्हती. भारतीय कम्युनिस्ट पक्षाचे ६ ऑगस्ट १९२१ चे
page_13_line_12.png,"नियतकालिक -सोशॅलिस्ट' म्हणते, ""ब्राह्मणेतर चळवळ ही अर्थहीन आहे. या"
page_13_line_13.png,चळवळीची प्रेरणा एकदम संकुचित आहे. जातीय द्वेश हा तिचा मुख्य आधार आहे.
page_13_line_14.png,"या चळवळीला आर्थिक पाया नाही.""क्रांतिसिंहाना हे दुःख पुढच्या जीवनात राहिले."
page_13_line_15.png,ब्राह्मणेतर चळवळीचे जातीय शोषणाविरुद्ध असलेले अंग कम्युनिस्ट पक्षाला कधी
page_13_line_16.png,दिसलेच नाही. जातिव्यवस्थेकडे आर्थिक शोषणाचे हत्यार म्हणून पक्षाने पाहिलेच
page_13_line_17.png,नाही. क्रांतिसिंहाच्या दृष्टीने जातिव्यवस्थेचा अंत झाल्याशिवाय भारतीय क्रांतीच
page_13_line_18.png,अशक्य होती. त्यांच्या मृत्यूनंतर २५ वर्षांनी आज हे सत्य कुणी पुरोगामी
page_13_line_19.png,छातीठोकपणे नाकारू शकणार नाही. कारण ब्राह्मण्यवादी जातिव्यवस्थेचे पुरस्कर्ते
page_13_line_20.png,राज्य सत्तेवर बसू शकले आहेत.
page_14_line_1.png,१९३० ते १९४२ मधली मज्ञागत
page_14_line_2.png,"""नाना पाटील बोलत होते, 'बा मेला, त्याला जाळला वड्याच्या काठाला."
page_14_line_3.png,त्याच्यासाठी पुन्हा भाताचं गोळं करून ठिवायचं. पिंडाला कावळा शिवला पायजे.
page_14_line_4.png,याचा अन्‌ कावळ्याचा काय संबंध ते एक मंतर सांगणाऱ्या बामनालाच ठावं.
page_14_line_5.png,पिंड पाडणाऱ्यानं हुभं ऱ्हायाचं. हात जोडायचं. कुणाला? झाडावरच्या
page_14_line_6.png,"कावळ्याला. त्याला आर्जव करायची, ये महाराजा, पिंडाला निसती टोच हान."
page_14_line_7.png,"तुझ्या मनातल्या सगळ्या इच्छा मी पुऱ्या करीन. ये, ये. कावळं कशाचं येतंय?"
page_14_line_8.png,मानसाच्या गर्दीत कशाला इल शाना कावळा. तो झाडावर बसूनच काव काव करीत
page_14_line_9.png,ऱ्हातो. तास दोन तास मिन्त्या केल्या तरी कावळा काय पिंडाला शिवत न्हाई. मग
page_14_line_10.png,भडजी काय करतो? दरभाचा कावळा. त्यो खोटा कावळा पिंडाला शिवला की
page_14_line_11.png,मेलेला बा जेवला. थुः त्येचा.
page_14_line_12.png,"बाचं दिस संपलं की पुन्ना हायच. आपलं रान, आपली जियाबं, आपली पिकं."
page_14_line_13.png,पिकाची राखण तर डोळ्यांत त्याल घालून कराया होवी. ज्या हातानं पिंड पाडलं
page_14_line_14.png,त्याच हातात मग गोफन. हातं काय कावळ्याला आवतान लागत न्हाई. झुंडीच्या
page_14_line_15.png,झुंडी उतरत्यात वलां जुंदळा खायला. मग कावळ्याला हात कोन जोडतंय? मग
page_14_line_16.png,"भिरीरी धोंडं, शिव्या! हे काय याड म्हणावं का खुळ?' सारा जमाव हसू लागला."
page_14_line_17.png,"हसता हसता थबकला. वक्त्याने त्यांना समजावून सांगितले, 'आपूनच आपल्याला"
page_14_line_18.png,"हसावं अशा या रूढी फेकून द्या, शानं व्हा..."" ग. दि. माडगूळकरांनी'मी सिंह"
