page_23_line_27.png,लागू होत तज्लीच जरा बदलून 'स्वातंत्र्याच्या' सरकारला लागू होत. हास्यविनोद
page_23_line_28.png,करीत घणाघाती टीकाही होत होती. प्रबोधन होत होते. महाराष्ट्राने असा वक्ता
page_24_line_1.png,त्यांच्यानंतर आजतागायत पाहिला नाही. एका खेड्यात सभा असली तर नाना
page_24_line_2.png,पाटलांची सभा ऐकायला बैलगाड्या जुंपून बायका-मुलांसह शेजारच्या गावांची
page_24_line_3.png,हजारो माणसं सभेला येत असत. अशा सभाही आता कुठे दिसत नाहीत. त्या
page_24_line_4.png,मंतरलेल्या काळातल्या मंतरलेल्या सभा होत्या. नाना पाटील त्या काळाचे मांत्रिक
page_24_line_5.png,होते.
page_24_line_6.png,क्रांतिकारी फकिराचा जन्म
page_24_line_7.png,क्रांतिसिंह अण्णांचा जन्म जरी ३ ऑगस्ट १९०० रोजी झाला असला तरी
page_24_line_8.png,त्यांचा क्रांतिकारी फकीर म्हणून राजकीय-सामाजिक कार्यकर्त्याच्या रूपात जन्म
page_24_line_9.png,झाला तो १९३० साली.
page_24_line_10.png,१९१८-२० सालापासूनच अण्णा सत्यशोधक चळवळीत काम करीत होते.
page_24_line_11.png,त्याच काळात १९२० साली त्यांची तलाठ्याची नोकरी सुर झाली. १९२६-२७
page_24_line_12.png,"सालापासून ते काँग्रेसच्या, म. गांधींच्या नेतृत्वाखालील चळवळीत सहभागी होऊ"
page_24_line_13.png,लागले. १९२८ साली त्यांच्यावर गावाचा जमा झालेला शेतसारा वेळेत जमा केला
page_24_line_14.png,नाही म्हणून सरकारने गुन्हा दाखल केला. चौकशी सुरू होण्याच्या काळातच ते
page_24_line_15.png,नोकरी सोडून काँग्रेसच्या प्रचार कार्यासाठी गावोगाव फिरू लागले. १९३० सालचा
page_24_line_16.png,"जंगल सत्याग्रह, कायदेभंगाची चळवळ यात त्यांनी हिरिरीने भाग घेतला. १९३० ते"
page_24_line_17.png,१९३२ या काळात त्यांच्यावर असलेल्या पकड वॉरंटला धाब्यावर बसवून ते फरारी
page_24_line_18.png,म्हणून राहिले. पण हा फरारी जगावेगळाच होता. त्यांनी डोंगरदऱ्यात लपून-झपून
page_24_line_19.png,"राहण्याऐवजी जनतेच्या उसळत्या सागरात सामावून जाण्याचा, त्या जनसागराच्या"
page_24_line_20.png,लाटांवर आरूढ होऊन पोलिसांच्या हाताला न लागण्याचा निर्णय घेतला. दोन वर्षे
page_24_line_21.png,सातारा जिल्ह्यातले गाव न्‌ गाव त्यांनी पिंजून काढले. एवढेच नाही तर बेळगाव-
page_24_line_22.png,"कोल्हापूरपासून मराठवाड्यापर्यंत, मुंबईपर्यंत ते सभा घेत फिरले."
page_24_line_23.png,१९३२ साली तुरुंगात जाताना त्यांच्यावर राजकीय केसेसबरोबरच शेतसारा
page_24_line_24.png,वेळेत न भरण्याचा गुन्हा दाखल होताच. त्यांचे कराड येथील काँग्रेसमधले एक
page_24_line_25.png,सहानुभूतीदार श्री. बटाणे त्यांना सांगत होते की 'तुम्ही गावकामगार पाटलाकडे
page_24_line_26.png,शेतसारा दिला होता त्यामुळे तुम्ही ते सत्य सांगून मोकळे व्हा. या गुन्ह्यात अडकू
page_24_line_27.png,नका.' पण नाना पाटलांनी ही भूमिका मान्य केली नाही. “यामुळे पाटलाचे पिढ्या न्‌
page_24_line_28.png,पिढ्यांचे वतन जाईल. त्याचे मोठेच नुकसान होईल. मी नोकरी करणारच नाही
page_25_line_1.png,आणि जी शिक्षा होईल त्या शिक्षेमुळे माझे काही बिघडणार नाही. मी पाटलाला
page_25_line_2.png,"वाचवणार' असे त्यांनी ठामपणे सांगितले. एका बाजूला हा गुन्हा, दुसऱ्या बाजूला"
page_25_line_3.png,काँग्रेसच्या चळवळीतले दाखल झालेले गुन्हे आणि तिसऱ्या बाजूला दोन वर्षे फरारी
page_25_line_4.png,होणे या सर्वामुळे इंग्रजांच्या कोर्टाने त्यांना सक्तमजुरीची शिक्षा ठोठावली. चक्की
page_25_line_5.png,पिसण्याची म्हणजेच मोठ्या जात्याने दळण्याची शिक्षा त्यांना मिळाली!
page_25_line_6.png,त्यांच्या एकुलत्या एका कन्येचा जन्म १९२६ साली झाला. फरारी असतानाच
page_25_line_7.png,१९३० साली पत्नी आकुबाई यांचा मृत्यू झाला. त्या पाठोपाठ आजीही निवर्तल्या.
page_25_line_8.png,वैयक्तिक जीवनात अशी संकटे एकामागून एक कोसळत गेली. अण्णा डगमगले तर
page_25_line_9.png,नाहीतच पण त्यांनी या दुःखांच्या पार्श्वभूमीवरच “घर' नावाची जीवनातली एक
page_25_line_10.png,"अत्यंत महत्त्वाची गोष्ट पूर्णपणे सोडली. आई, वडील, भाऊ, बहीण आणि तीन-चार"
page_25_line_11.png,वर्षांची मुलगी यांच्याशी असलेले मायेचे पाश नजरेआड केले. त्यांनी गावोगावाच्या
page_25_line_12.png,कार्यकर्त्यांची घरेच आपली मानायला सुरुवात केली. अशी शेकडो घरे त्यांची होत
page_25_line_13.png,गेली. अण्णा आपल्या घरी राहिले आणि जेवले याचा अभिमान बाळगणारी ही घरे
page_25_line_14.png,"त्यांच्या आवडीनिवडी समजून घेऊ लागली. केवळ भाजी-भाकरी, माडगं-पिठलं"
page_25_line_15.png,अशा गरिबा घरच्यांना त्रास न होता पुरवता येतील अशाच त्यांच्या आवडीनिवडी
page_25_line_16.png,होत्या. शर्ट आणि पहिलवानी पांढरी लुंगी असा पोशाख अत्यंत साध्या राहणीमानात
page_25_line_17.png,त्यांनी आयुष्याच्या अखेरीपर्यंत स्वीकारला. अशा एकंदर प्रकियेतून एका क्रांतिकारी
page_25_line_18.png,फकिराची देणगी महाराष्ट्राच्या आणि देशाच्या सामाजिक-राजकीय चळवळीला
page_25_line_19.png,मिळाली.
page_25_line_20.png,त्यांच्या कन्या श्रीमती हौशाताई भगवानराव पाटील यांनी या काळातली जी
page_25_line_21.png,आठवण सांगितली आहे ती फारच बोलकी आणि मनाला चटका लावून जाणारी
page_25_line_22.png,"आहे. त्या म्हणतात, ""क्रांतिसिंह नाना पाटील हे माझे वडील. आम्ही त्यांना दादा"
page_25_line_23.png,म्हणत असू. दादांनी देशासाठी फकिरी स्वीकारल्यावर आमच्या कुटुंबावर अनेक
page_25_line_24.png,अस्मानी व सुलतानी आपत्ती आल्या. दादांच्या जवळची नात्याची माणसे; माझी
page_25_line_25.png,"आई, आजोबा व पणजी एकामागून एक याप्रमाणे जगाचा निरोप घेऊन गेली. ही"
page_25_line_26.png,आठवण आहे माझ्या पणजीच्या म्हणजे दादांच्या आजीच्या मृत्यूसमयीची.
page_25_line_27.png,"""माझ्या आजोबांना जाऊन महिना होतो न होतो तोच दादांच्या आजीने"
page_25_line_28.png,अंथरूण धरले.अगोदरच तिचे वय झाले होते. त्यातच आमच्या कुटुंबावर होणारे
page_26_line_1.png,मृत्यूचे आघात त्या बिचारीला सहन झाले नाहीत. तिचे आपल्या नातवावर म्हणजे
page_26_line_2.png,दादांवर खूप प्रेम होते. शेवटच्या दिवसांत तिने आपल्या लाडक्या नातवाच्या भेटीचा
page_26_line_3.png,"ध्यासच घेतला होता. नात्यातील सर्वांनाच वाटत होते की, मृत्यूपूर्वी दादांची व तिची"
page_26_line_4.png,"भेट व्हावी, पण हे घडावे कसे? दादांच्यावर सरकारचे पकड वॉरंट होते व पोलीस"
page_26_line_5.png,अहोरात्र त्यांच्या पाळतीवर होते.
page_26_line_6.png,"""भूमिगत अवस्थेत असणाऱ्या दादांच्या कानावर आजीचा आजार व तिने"
page_26_line_7.png,घेतलेल्या ध्यासाची वार्ता गेली. दादांच्या हृदयात कालवाकालव सुरू झाली. तिचा
page_26_line_8.png,"त्यांच्यावर विलक्षण जीव होता, या विचारांनी त्यांना बेचैन केले. शेवटी त्यांनी निर्णय"
page_26_line_9.png,"घेतला की पोलिसांच्या हाती सापडलो तरी बेहतर, पण आजीची शेवटची भेट"
page_26_line_10.png,घ्यायची!
page_26_line_11.png,"""आणि एक दिवस भल्या पहाटे निघून दिवस उजाडायच्या आत दादा घरात"
page_26_line_12.png,हजर झाले !बरोबर त्यांचे साथीदार पण होते. त्या सर्वांनी अत्यंत गुप्ततेने येण्याची
page_26_line_13.png,योजना आखली होती. दादांना पाहताच घरादाराला आनंद झाला. ते धावतच
page_26_line_14.png,आजीजवळ गेले व त्यांनी तिला हाक मारून आपण आल्याचे सांगितले. लाडक्या
page_26_line_15.png,नातवाला पाहून आजीच्या डोळ्यांत आनंदाश्रू आले. तिने त्यांच्या गालावरून आपले
page_26_line_16.png,थरथरते हात फिरवले. दादांच्याही डोळ्यांतून अश्रू वाहू लागले. त्यांनी आजीचे
page_26_line_17.png,मस्तक आपल्या मांडीवर घेतले. थोड्याच वेळात आजीने नातवाच्या मांडीवर प्राण
page_26_line_18.png,सोडला. जणू याच क्षणाची ती वाट पाहात होती!
page_26_line_19.png,"""घरात मृत्यूने आपले काम पुरे केले. त्याच वेळी गावात वेगळेच नाट्य सुरू"
page_26_line_20.png,झाले होते. कशी कोण जाणे पण दादा आपल्या साथीदारांसह आपल्या घरी
page_26_line_21.png,आल्याची खबर पोलिसांना मिळाली होती. ते गावात येऊन त्यांनी आमच्या वाड्यास
page_26_line_22.png,वेढा दिला होता. पण घराजवळ येताच आतील रडारड ऐकून ते बाहेरच थबकले
page_26_line_23.png,होते. अशा प्रसंगी दांडगावा करून आत शिरणे अप्रशस्त होईल अथवा त्यामुळे
page_26_line_24.png,एखादा अनावस्था प्रसंग ओढवेल अशी पोलीस अधिकाऱ्याची भावना झाली असावी.
page_26_line_25.png,कदाचित त्याच्यातली माणुसकीही जागी झाली असेल किंवा त्याने असाही विचार
page_26_line_26.png,"केला असेल की सावज तर आता हाती आले आहेच, उगीच गडबड कशाला?"
page_26_line_27.png,एवढेच नव्हे तर आजीची अंत्ययात्राही काढावयास त्याने परवानगी दिली!
page_27_line_1.png,"""आजीच्या निधनाचे दुःख आणि दादांच्या अटळ अटकेची चिंता अशा दुहेरी"
page_27_line_2.png,संकटाने सर्वांना घेरले होते. मृत्यू अटळ होता. पण पोलिसांकडून होणारी अटक
page_27_line_3.png,टाळणे हे दादांच्या व त्यांच्या यशवंत पुणदीकरसारख्या साथीदारांच्या
page_27_line_4.png,बुद्धिचातुर्यावर अवलंबून होते. बुद्धिचातुर्याने त्यांना दगा दिला नाही. त्यांनी एक
page_27_line_5.png,क्लुप्ती योजली. आजीची तिरडी तयार झाली. त्यावर आता दादांनी झोपावे व
page_27_line_6.png,आजीचे प्रेत शेणीच्या पोत्यात बांधून गाडीतून स्मशानापर्यंत न्यावे असे ठरले. पण
page_27_line_7.png,दादांच्या आईला ही युक्ती पटेना. “माझ्या लेकाला जिवंतपणी मी तिरडीवर बांधू
page_27_line_8.png,देणार नाही' असा तिने पवित्रा घेतला. शेवटी तिच्याच लेकाच्या भल्यासाठी हे
page_27_line_9.png,नाटक करावे लागणार आहे अशी समजूत घालण्यात दादांचे साथीदार यशस्वी
page_27_line_10.png,झाले.
page_27_line_11.png,"""थोड्याच वेळात घरातून आजीची अंत्ययात्रा निघाली. सोबतची शेणीची"
page_27_line_12.png,गाडीही होती. अंत्ययात्रा स्मशानापर्यंत पोहोचली असेल नसेल तोवर पोलीस घरात
page_27_line_13.png,शिरले. दादांचा शोध घेऊ लागले. पण दादा त्यांना कुठेच दिसले नाहीत. सर्व
page_27_line_14.png,बाजूंनी कडेकोड बंदोबस्त करूनही नाना पाटील कसे निसटले हे त्यांना फार
page_27_line_15.png,"उशिरा समजले!!!"""
page_27_line_16.png,"हा प्रसंग म्हणजे दुःख, संयम, चित्तथरारक घटना यांचे जिवंत मिश्रण आहे."
page_27_line_17.png,यातल्या सर्व यातना पचवून अण्णांनी आपली फकिरी जोपासली. फकिरीला धक्का
page_27_line_18.png,लागू दिला नाही. पुन्हा घराच्या “मायापाशात' ते जराही गुंतले नाहीत. १९३६ साली
page_27_line_19.png,त्यांनी आपली बहीण गंगूबाई हिचे लग्न कुंडलाचे एक कार्यकर्ते श्री. नाथाजी लाड
page_27_line_20.png,यांच्याशी आयोजित केले. नाथाजी पुढे १९४२च्या प्रतिसरकारातले एक प्रमुख
page_27_line_21.png,कार्यकर्ते बनले. हे लग्न गांधी पद्धतीने अवघ्या १५ रुपये खर्चात झाले. १९४० साली
page_27_line_22.png,कन्या हौशाताईंचे लग्न खानापूर तालुक्यातील हणमंत वडियेचे श्री. भगवानराव
page_27_line_23.png,पाटील यांच्याशी झाले. तेही गांधीपद्धतीने होऊन फक्त २० रुपये खर्चात पार पाडले
page_27_line_24.png,गेले. भगवानराव पाटीलही पुढे प्रतिसरकारचे एक प्रमुख कार्यकर्ते म्हणून पुढे आले.
page_27_line_25.png,"या घरच्या लग्नांच्या बाबतीतच सर्व रूढींना फाटा देऊन, स्वातंत्र्य चळवळीशी नाते"
page_27_line_26.png,जोडून आणि कमीत कमी खर्च करून *गांधी लग्ने' लावण्याची रीत क्रांतिसिंहांनी
page_27_line_27.png,स्वतः आचरणात आणून दाखवली. मग त्यांनी ती जगाला सांगितली. अशी लग्ने
page_27_line_28.png,शेकडोंच्या संख्येने सातारा जिल्ह्यात लावली गेली. त्यामुळे माणसे स्वातंत्र्य
page_27_line_29.png,"चळवळीशी जोडली गेली, अंधश्रद्धा आणि ब्राहमण्यवादी रूढीपासून मुक्त झाली"
page_28_line_1.png,
page_28_line_2.png,"आणि कर्जबाजारी होण्यापासून वाचली. या लग्नात हुंडा, वाजंत्री, घोडा, बाशिंग या"
page_28_line_3.png,सर्व गोष्टींना फाटा दिला जाई. वधू-वरांना नवे खादीचे कपडे आणि एकमेकांना
page_28_line_4.png,घालण्यासाठी सुताचे दोन हार यासाठी जेवढा लागेल तेवढाच खर्च या लग्नाला
page_28_line_5.png,यायचा. जमलेल्यांनी स्वातंत्र्य चळवळीतली गाणी आणि मंगलाष्टका म्हटल्या की
page_28_line_6.png,"काम भागायचे. अशी लग्न पद्धती, जातिव्यवस्थेला विरोध करणारी, बिनखर्चाची,"
page_28_line_7.png,"ब्राह्मण्याला सोडचिठ्ठी देणारी, स्रियांच्या स्वातंत्र्याचा पुकारा करणारी, सर्वांना"
page_28_line_8.png,शिक्षण देण्याची शपथ घेणारी प्रथम महात्मा फुलेंनी सुरू केली. “सत्यशोधक लग्न
page_28_line_9.png,पद्धती' म्हणून पुढे आणली. क्रांतिसिंहांनी सुरुवातीच्या (१९२० पासून १९३०-३२
page_28_line_10.png,पर्यंतच्या) काळात याच पद्धतीचा प्रसार केला. नंतर 'गांधी लग्न'म्हणून जास्त
page_28_line_11.png,मोठ्या प्रमाणात प्रचारात आणले.
page_28_line_12.png,ही दोन लग्ने झाल्यावर तर अण्णा १०१ टक्के फकीर झाले. क्रांतिकारी
page_28_line_13.png,परिवर्तनासाठी त्यांनी पायाला भिंगरी बांधून भ्रमण सुरू केले. आयुष्याच्या
page_28_line_14.png,अखेरपर्यंत त्यांनी ही क्रांतिकारी फकिरी अभिमानाने आणि निष्ठेने पाळली. म्हणूनच
page_28_line_15.png,ते क्रांतिसिंह झाले. पण अशी फकिरी पत्करण्याच्या आधी त्यांनी ही महत्त्वाची
page_28_line_16.png,ग्रहस्थी कर्तव्येही आपल्या सामाजिक तत्त्वांना बाधा न आणता पार पाडली. त्या
page_28_line_17.png,आधी स्वतःचे लग्न झाल्यावर सत्यशोधक तत्त्वाप्रमाणे पत्नीला बरोबरीने वागवले.
page_28_line_18.png,जुन्या वळणाच्या आजीचा विरोध प्रेमाने आणि ठामपणे मोडून काढून स्वतःच
