page_1_line_1.png,क्रांतिसिंहांच्या ऐन तारुण्यापर्यंतचा महाराष्ट्र आणि सातारा जिल्हा
page_1_line_2.png,१९२८-१९३० ते १९७६ पर्यंत संपूर्ण महाराष्ट्राला गवसणी घालणारे एक
page_1_line_3.png,"वादळ मराठी माणसांच्या सामाजिक, राजकीय आणि सांस्कृतिक जीवनामध्ये"
page_1_line_4.png,"घोंघावत राहिले. क्रांतिसिंह नाना पाटील हे या वादळाचे नाव. साधी सुती लुंगी,"
page_1_line_5.png,सुती नेहरू शर्ट आणि धिप्पाड शरीरयष्टी या वैशिष्ट्यांना घेऊन त्यांचे व्यक्तिमत्त्व
page_1_line_6.png,मराठी माणसांच्या समुद्रात माशासारखे विहार करीत राहिले. शडू ठोकल्याशिवाय
page_1_line_7.png,त्यांनी कधीच भाषणाला सुरुवात केली नाही. भाषण सुरू झाल्यावर ऐकणाऱ्याला
page_1_line_8.png,भोवतालच्या वास्तवाचे भानच राहू नये इतके सततच मंत्रमुग्ध केले. त्यांच्याच
page_1_line_9.png,"भाषणाला स्रिया, पुरुष, तरुण-तरुणी, मुली-मुले ५-१० गावांमधून बैलगाड्या"
page_1_line_10.png,जुंपून आलेले उभ्या महाराष्ट्राने अनुभवले. तीन-तीन तास चाललेले भाषण संपले
page_1_line_11.png,तरी अजून चालूच राहावे अशी आस जनतेला त्यांच्या भाषणाविषयी नेहमीच
page_1_line_12.png,लागायची.
page_1_line_13.png,महाराष्ट्रातल्या गावागावाने नाना पाटलांना अंगाखांद्यावर वागवले. त्यांना
page_1_line_14.png,"वाद्य-संगीताच्या, लेझिमाच्या, बैलांच्या घुंगरांच्या तालात मिरवणुकींमधून मिरवले."
page_1_line_15.png,हजारो कुटुंबांनी त्यांना भाजी-भाकरी-पिठलं जेवायला घातले. शेकडो कुटुंबांनी
page_1_line_16.png,त्यांना घरच्याप्रमाणे आपल्या घरांमध्ये सामावून घेतले. त्यांचे विचार हजारो बाल
page_1_line_17.png,"मनांवर, तरुण मनांवर संस्कार करीत गेले. या संस्कारातूनच शेकडो कार्यकर्ते"
page_1_line_18.png,तयार झाले. जीवावर उदार होऊन स्वातंत्र्यासाठी लढणारे अनेक तरुण क्रांतिवीर
page_1_line_19.png,त्यांच्या विचारांच्या प्रभावाने घडत गेले. राबणाऱ्या जनतेच्या कुशीतून निपजलेले
page_1_line_20.png,शेकडो अर्धशिक्षित शेतकरी -मजूर कार्यकर्ते त्यांच्या संस्कारांना उराशी कवटाळून
page_1_line_21.png,गावागावांना घडवीत गेले. चळवळीची केंद्रे असलेली गावे उभारत गेले.
page_1_line_22.png,पुस्तके वाचण्याबरोबर जीवन कसे वाचायचे याची शाळा क्रांतिसिंह नाना
page_1_line_23.png,पाटलांनी ४७-४८ वर्षे सलगपणे चालवली. अनेक चढउतार त्यांच्या जीवनातआले.
page_1_line_24.png,व्यक्तिगत जीवनातही अनेक आघात झेलावे लागले. आपले म्हणवणाऱ्या
page_1_line_25.png,माणसांकडून जखमा सहन कराव्या लागल्या. क्रांतिसिंहाच्या चेहऱ्यावर दुःख कधी
page_1_line_26.png,"दिसले नाही. स्वतःच्या दुःखांवरही विनोद करीत, जनतेच्या दुःखांची उकलही"
page_1_line_27.png,विनोदाने घडवत त्यांनी क्रांतिकारी विचारच पेरला. आशा पेरली. निराशा कधीच
page_1_line_28.png,"पेरली नाही. महात्मा फुले, राजर्षी शाहू आणि डॉ. बाबासाहेब आंबेडकरांच्या"
page_2_line_1.png,महाराष्ट्रामध्ये हे एक आगळे ऐतिहासिक अक्रित घडले. महाराष्ट्राच्या इतिहासाने
page_2_line_2.png,त्यांना घडवले आणि त्यांनी महाराष्ट्राचा इतिहास घडवला.
page_2_line_3.png,महात्मा जोतीबा फुले यांनी आपली बहुतांश काव्यरचना 'अखंड' यास्वरूपात
page_2_line_4.png,केली. विद्रोही संत तुकारामांच्या 'अभंग' काव्यरचनेचा महान वारसा सांगत
page_2_line_5.png,जोतीबांनी 'अखंड' लिहिले. ३ ऑगष्ट १९०० रोजी वाळवे तालुक्यातील यडे मच्छिंद्र
page_2_line_6.png,या खेड्यात जन्माला आलेल्या नाना पाटलांनी 'अखंड' क्रांतिकारी जीवन जगून
page_2_line_7.png,विद्रोही संत तुकाराम आणि महात्मा फुले यांची परंपरा आधुनिक काळात पुढे नेली.
page_2_line_8.png,तत्कालीन सातारा जिल्ह्याची क्रांतिकारी परंपरा उज्ज्वल केली. १५ ऑगष्ट १९४७
page_2_line_9.png,"नंतर शेतकरी कामगार पक्ष', “कामगार किसान पक्ष' आणि “कम्युनिस्ट पक्ष' असा"
page_2_line_10.png,प्रवास करून आंतरराष्ट्रीय क्रांतिकारी परंपरेशी नाते जोडले. देशी
page_2_line_11.png,क्रांतिकारकत्वाला धक्का न लावता आंतरराष्ट्रीय क्रांतिकारक विचारांचा स्विकार
page_2_line_12.png,केला. अशा क्रांतिसिंह नाना पाटील यांचा जन्म ज्या काळात झाला त्या काळात
page_2_line_13.png,"त्यांच्यावर संस्कार करणारा महाराष्ट्र आणि सातारा जिल्हा कोणत्या सामाजिक,"
page_2_line_14.png,राजकीय आणि आर्थिक अवस्थेत होता हे समजून घेणे महत्त्वाचे आहे.
page_2_line_15.png,महात्मा फुलेंच्या मृत्युनंतर दहा वर्षांनी नाना पाटलांचा जन्म झाला. राजर्षी
page_2_line_16.png,"शाहुमहाराजांनी ब्राह्मण, प्रभु, पारशी, शेणवी अशा पुढारलेल्या जात-धर्म विभागांच्या"
page_2_line_17.png,लोकांना वगळून इतर सर्वांसाठी राखीव जागा ठेवण्याचा जगाच्या पातळीवर
page_2_line_18.png,महत्त्वाचा ठरणारा ऐतिहासिक निर्णय घेतला तो क्रांतिसिंहाच्या जन्मानंतर दोनच
page_2_line_19.png,"वर्षांनी म्हणजे १९०२ साली. नाना पाटील ऐन तारुण्याच्या उंबरठ्यावर असताना,"
page_2_line_20.png,"१९१९ ते १९२१ या काळात, सातारा जिल्ह्यातील कूळ शेतकरी आणि बलुतेदारांचा"
page_2_line_21.png,संयुक्त संप आणि संघर्ष ग्रामीण भागातील परिवर्तनाची वाट उजळून गेला. १९१०
page_2_line_22.png,सालापासून पुढे सातारा जिल्ह्यात सत्यशोधक तमाशांचे कसदार पीक उभारून येऊ
page_2_line_23.png,"लागले. लहान-थोरांवर संस्कार करू लागले. मुकुंदराव पाटील, श्रीपतराव शिंदे,"
page_2_line_24.png,दिनकरराव जवळकर अशा सत्यशोधक ब्राह्मणेतर म्होरक्यांनी काढलेली
page_2_line_25.png,नियतकालिके याच काळात प्रसारित होत होती. त्याचबरोबर महात्मा गांधींसारखे
page_2_line_26.png,बहुजन स्त्री-पुरुषांपर्यंत पोहोचणारे धोरणी नेतृत्व राष्ट्रीय काँग्रेसमध्ये उगम
page_2_line_27.png,पावण्याच्या काळात क्रांतिसिंह २०-३० वर्षांचे होते.
page_3_line_1.png,समजायला लागल्यापासून नानांच्या मनावर कोणते संस्कार झाले हे फार
page_3_line_2.png,महत्त्वाचे आहे. कारण त्यातूनच त्यांची मनोभूमिका प्रामुख्याने ठरत गेली. हे संस्कार
page_3_line_3.png,वेगवेगळ्या अंगानी घडतात. भोवतालची सामाजिक-आर्थिक परिस्थिती आपोआपच
page_3_line_4.png,"परिणाम करीत असते. समाजातल्या सामाजिक, सांस्कृतिक आणि राजकीय"
page_3_line_5.png,संघटना जाणीवपूर्वक परिणाम घडवीत असतात. परिसराच्या आणि घराच्या
page_3_line_6.png,ऐतिहासिक परंपरासुद्धा मने घडवीत असतात. क्रांतिसिंहांचे चरित्र आणि चारित्र्य
page_3_line_7.png,याच प्रक्रियेतून घडत गेले.
page_3_line_8.png,त्यावेळच्या महाराष्ट्राची सामाजिक-आर्थिक रचना
page_3_line_9.png,त्या वेळचा महाराष्ट्र जातीय उतरंडीतून होणाऱ्या पिळणुकीने गांजलेला
page_3_line_10.png,होता. मुंबईसारखे शहर विकसित होत होते. कारखानदारी नावाची नवीनच
page_3_line_11.png,भांडवली गोष्ट उदयाला आली होती. देशाला गुलाम करणाऱ्या इंग्रजांनी इथे
page_3_line_12.png,कारखानदारी आणि भांडवलशाही आयात करून लादली होती. तरीसुद्धा
page_3_line_13.png,महाराष्ट्रातील नव्वद टक्क्यांपेक्षा जास्त जनता ग्रामीण भागातच राहत होती.
page_3_line_14.png,"ब्राह्मण, स्वतःला उच्चकुलीन समजणारे मराठे, शेतकरी मराठे किंवा कुणबी-"
page_3_line_15.png,"कुरवाडी, माळी, धनगर, सुतार, लोहार, शिंपी, कोष्टी, भोई, सोनार, कुंभार, परीट,"
page_3_line_16.png,"न्हावी, घिसाडी, कोळी अशा स्पृश्य बलुतेदार जाती आणि तळाला महार, मांग,"
page_3_line_17.png,"चांभार, ढोर अशा अस्पृश्य जाती या शोषणाच्या उतरंडीत समाज बांधलेला होता."
page_3_line_18.png,ब्राह्मण्यवादी धर्माने घालून दिलेले नीतिनियम पाळण्याची सक्ती सार्वत्रिक होती.
page_3_line_19.png,जातिव्यवस्थेचे नियम मोडले तर वाळीत टाकले जात होते. म्हणजेच सामाजिक
page_3_line_20.png,व्यवहारापासून तोडून एकटे पाडले जात होते. जगणे कठीण केले जात होते.
page_3_line_21.png,"मुंबईला जाऊन गिरण्या-कारखान्यात, रेल्वेत कामगार होणे हा या पिळणुकीतून"
page_3_line_22.png,काही प्रमाणात बाहेर जाऊन जगण्याचा एक नवा मार्ग होता.
page_3_line_23.png,येडे मच्छिंद्र हे क्रांतिसिंहांचे जन्मगाव. या गावाचे शिवार कृष्णा नदीच्या
page_3_line_24.png,काठावर असले तरी हे गाव डोंगराजवळ वसलेले आहे. या गावा शेजारीच 'मच्छिंद्र
page_3_line_25.png,गड' नावाचा किल्ला आहे. नाथ पंथातील मच्छिंद्रनाथांचे ठाणेसुद्धा या किल्ल्यावर
page_3_line_26.png,आहे. महाराष्ट्रात जातिव्यवस्थेविरोधी जे प्रवाह झाले त्यातलाच नाथ पंथ होता हे
page_3_line_27.png,या ठिकाणी लक्षात घेतले पाहिजे. गावाचे नावसुद्धा मच्छिंद्रनाथांचा समावेश
page_3_line_28.png,करणारे आहे. क्रांतिसिंह अनेक वेळा 'येडे' या नावावरून स्वतःच्या भाषणात विनोद
page_4_line_1.png,"करीत असत. ""मी येड्याचा""एवढे म्हणण्यातूनही संपूर्ण समुदायाला हसू फुटत असे."
page_4_line_2.png,"इतर गावांप्रमाणेच याही गावाची माणसे, त्या काळी शेतातून, येणाऱ्या उत्पन्नावर"
page_4_line_3.png,संसार चालत नाही म्हणून मुंबईला मजुरी करायला जात असत. कृष्णा नदी जरी
page_4_line_4.png,जवळ असली तरी तिचे पाणी शेती बागायतीखाली आणायला उपयोगी पडत नव्हते.
page_4_line_5.png,१९६७-१९७१ पासून पुढेच उपसासिंचन योजनांमुळे या परिसरातील शेतीला
page_4_line_6.png,बारमाही पाणी मिळू लागले. क्रांतिसिंहांच्या आडनावात “पाटील' असले तरी त्यांचा
page_4_line_7.png,जन्म कष्टकरी शेतकरी कुटुंबात झाला होता. सर्व कुटुंब शेतावर राबून शेती करते
page_4_line_8.png,अशी स्थिती होती. ब्राह्मणी व्यवस्था अशा सर्व आडनाव-पाटलांना कुणबी-
page_4_line_9.png,कुरवाडीच म्हणत होती. १८८१ च्या बॉम्बे प्रेसिडेंसीच्या गॅझेटियरमध्ये सातारा
page_4_line_10.png,"जिल्ह्याची लोकसंख्या १०,६२,३५० होती आणि कुणबी समाजाची संख्या"
page_4_line_11.png,"५,८३,५६९ होती असे नमूद केले आहे. म्हणजेच हा समाज ५४-९ टक्के एवढा होता."
page_4_line_12.png,१८८१ च्या गॅझेटमधे “मराठा' म्हणून वेगळी जात नमूद नाही. आज सातारा जिल्ह्यात
page_4_line_13.png,स्वतःला कुणबी म्हणवणारे कुणीच सापडणार नाही! इनामदार घरातील विद्रोही
page_4_line_14.png,संत तुकारामापासून ते छत्रपती शिवाजीमहाराज आणि राजर्षी शाहूमहाराजांपर्यंत
page_4_line_15.png,सर्वांना शूद्र आणि कुणबी संबोधण्याचा इतिहास आहेच!! थोडक्यात क्रांतिसिंह
page_4_line_16.png,राबणाऱ्या वर्ग-जातीत जन्मले होते आणि त्या काळात या जातीला शूद्रच समजले
page_4_line_17.png,जात होते.
page_4_line_18.png,त्या वेळच्या दक्षिण महाराष्ट्राच्या कोणत्याही गावामध्ये तीन प्रकारच्या
page_4_line_19.png,"शेतकरी जाती होत्या. कुणबी( मराठा), कुणबी (माळी) आणि धनगर. उतरंडीच्या"
page_4_line_20.png,क्रमाने पुढे सर्व स्पृश्य बलुतेदार जाती होत्या. उतरंडीच्या तळाची अस्पृश्य बलुतेदार
page_4_line_21.png,जाती होत्या. ब्राह्मण उतरंडीत सर्वांच्या वर आणि सर्वांच्या डोक्यावर बसलेले होते.
page_4_line_22.png,"उच्च कुलीन मराठा समजणारे देसाई, देशमुख असेच सर्वांच्या डोक्यावर बसून"
page_4_line_23.png,शोषण करीत होते. पण जातीय उतरंडीत ते ब्राह्मणांपेक्षा खालच्या स्थानावर होते.
page_4_line_24.png,ब्राह्मण आणि संरजामदार मराठे सोडून सर्व जनता शारीरिक कष्ट केल्याशिवाय
page_4_line_25.png,ज्यांना जगताच येणार नाही अशा परिस्थितीत होती. स्वतःला उच्च कुलीन
page_4_line_26.png,समजणाऱ्या मराठ्यांमध्येसुद्धा फक्त १-७ टक्के कुटुंबे खंड वसूल करणारी होती
page_4_line_27.png,म्हणजेच सरंजामदार होती! त्यांच्यामध्ये ६३-८ कुटुंबे स्वतः शेती कसणारी आणि
page_4_line_28.png,२२-७ कुटुंबे शेतमजूर होती. १९११ साली झालेल्या पाहणीत अशी नोंद आहे.
page_4_line_29.png,कुणब्यांमध्ये अर्थातच एकही कुटुंब खंड घेणारे म्हणजेच सरंजमादार नव्हते.
page_4_line_30.png,त्यांच्यात ६१-६ टक्के स्वतः शेती कसणारी आणि २९-३ टक्के शेतमजूर कुटुंबे होती.
page_5_line_1.png,"या उलट चित्पावन (कोकणस्थ) ब्राह्मणांमध्ये २०-५ टक्के सरंजामदार, २५६ टक्के"
page_5_line_2.png,स्वतः शेती कसणारे शेतकरी होते! देशस्थ ब्राह्मणांमध्ये हे प्रमाण २०-८ आणि २३-१
page_5_line_3.png,तर गौड सारस्वतांमध्ये २१-० आणि १७-१ टक्के असे होते! या तिन्ही जातींमधे
page_5_line_4.png,शेतमजुरी करणारे कुटुंब एकही नव्हते!! उरलेली कुटुंबे शेती सोडून इतर
page_5_line_5.png,व्यवसायात होती. इतर सर्व बलुतेदार जातींमधील अर्धी कुटुंबे स्वतःच्या कष्टाने शेती
page_5_line_6.png,करणारी आणि अर्धी शेतमजुरी करणारी होती. जातींचा नेमलेला व्यवसाय तर ती
page_5_line_7.png,"करीतच होती. जातीय उतरंडीबाहेर असलेल्या भाट, चित्रकथी, गोंधळी, गोपाळ,"
page_5_line_8.png,"गोसावी, जंगम, कोल्हाटी, जोशी, उचले, वैदू, वासुदेव या समाजगटांना तर"
page_5_line_9.png,१८८१-८४ च्या गॅझेटमधे “भिकारी' असेच गणले आहे. त्यांना जमीन असण्याचा
page_5_line_10.png,प्रश्‍नच नव्हता आणि ते भटके जीवन जगत होते त्यामुळे त्यांच्यापैकी कुणी शेतमजूर
page_5_line_11.png,असण्याचा प्रश्‍न उद्‌भवतच नव्हता. आदिवासी जमातीही जातीय उतरंडीच्या बाहेर
page_5_line_12.png,समजल्या जात असल्यामुळे त्यांचा प्रहन वेगळाच होता. त्यांच्यावरच्या अन्यायांची
page_5_line_13.png,तऱ्हा वेगळीच होती.
page_5_line_14.png,"क्रांतिसिंहाचे जन्मगाव, अजोळ वगैरे परिसरातील गावांमध्ये आदिवासी"
